{
  "$schema": "https://json-schema.org/draft/2020-12/schema",
  "$comment": "The pin manifest, manifest_version 1 (CSR-WO-1001). Validated by the core's own validator with remote references off. Only canonical_form_version and tools are inside manifest_hash (docs/canonical-form.md A9, A10); generated_at and build are outside it.",
  "type": "object",
  "additionalProperties": false,
  "required": ["manifest_version", "canonical_form_version", "generated_at", "tools", "manifest_hash", "build"],
  "properties": {
    "manifest_version": { "const": 1 },
    "canonical_form_version": { "const": 1 },
    "generated_at": {
      "$comment": "RFC 3339, informational only, not hashed. The full form is checked by the loader; this prefix keeps the pattern within the validator's ReDoS guard.",
      "type": "string",
      "pattern": "^[0-9]{4}-[0-9]{2}-[0-9]{2}T"
    },
    "tools": {
      "$comment": "Sorted by name in UTF-16 code units, names unique (A9); the loader checks the order.",
      "type": "array",
      "items": {
        "type": "object",
        "additionalProperties": false,
        "required": ["name", "tool_hash"],
        "properties": {
          "name": { "type": "string", "pattern": "^[a-z0-9][a-z0-9._-]{0,63}$" },
          "tool_hash": { "type": "string", "pattern": "^[0-9a-f]{64}$" }
        }
      }
    },
    "manifest_hash": { "type": "string", "pattern": "^[0-9a-f]{64}$" },
    "build": {
      "$comment": "Slots present from the first manifest, nullable and NOT enforced (architecture section 5, Manifest schema).",
      "type": "object",
      "additionalProperties": false,
      "required": ["commit", "distribution_digest", "signature", "kid", "key_valid_from", "key_valid_to"],
      "properties": {
        "commit": { "$comment": "Enforced by the release-integrity control (architecture section 8, Manifest build block; deferred, trigger: the first fleet port that deploys from a release).", "type": ["string", "null"] },
        "distribution_digest": { "$comment": "Enforced by the release-integrity control (as commit).", "type": ["string", "null"] },
        "signature": { "$comment": "Enforced by manifest signing, which no work order holds yet (architecture section 5, Key identity and rotation). Null until then.", "type": ["string", "null"] },
        "kid": { "$comment": "The signing key's id; enforced with signature. Null until then.", "type": ["string", "null"] },
        "key_valid_from": { "$comment": "The key's validity window; enforced with signature.", "type": ["string", "null"] },
        "key_valid_to": { "$comment": "The key's validity window; enforced with signature.", "type": ["string", "null"] }
      }
    }
  }
}
