{
  "manifest_version": 1,
  "canonical_form_version": 1,
  "generated_at": "2026-09-26T18:37:07.037Z",
  "tools": [
    {
      "name": "notes.read",
      "tool_hash": "8d8cfa77e141f0dec1c96a23627e89fe8d94daa0ce4273df344418caf7057734"
    }
  ],
  "manifest_hash": "01dc0e9717972d1c2c5c0a4f4a2e83bf56919acfbccdda25f4b74aa0fe337134",
  "build": {
    "commit": null,
    "distribution_digest": null,
    "signature": null,
    "kid": null,
    "key_valid_from": null,
    "key_valid_to": null
  }
}
